{
  "$schema": "https://json-schema.org/draft/2020-12/schema",
  "$id": "https://orbrey.app/schemas/kitchen-concierge/dietary-profile.json",
  "title": "Household Dietary Profiles",
  "description": "Claude-only local food restrictions used by Kitchen Concierge. This file is separate from Orbrey account data. Current Orbrey member IDs are resolved with members_list; severity tiers and aliases are confirmed by the user because members_list does not return them.",
  "type": "object",
  "required": [
    "schema_version",
    "updated_at",
    "members"
  ],
  "additionalProperties": false,
  "properties": {
    "schema_version": {
      "const": 1
    },
    "updated_at": {
      "type": "string",
      "format": "date-time",
      "description": "Last confirmation. Profiles older than 90 days abort an ordering run when any member carries a life_threatening or medical_avoid restriction."
    },
    "source": {
      "type": "string",
      "enum": [
        "kitchen-concierge-setup",
        "manual",
        "household-onboarder"
      ],
      "default": "kitchen-concierge-setup"
    },
    "members": {
      "type": "array",
      "minItems": 1,
      "items": {
        "type": "object",
        "required": [
          "member_id",
          "display_name",
          "restrictions"
        ],
        "additionalProperties": false,
        "properties": {
          "member_id": {
            "type": "string",
            "description": "Orbrey member ID returned by members_list; used to match this local profile to the currently authorised roster."
          },
          "display_name": {
            "type": "string",
            "minLength": 1
          },
          "dietary_pattern": {
            "type": "string",
            "enum": [
              "omnivore",
              "vegetarian",
              "vegan",
              "pescatarian",
              "halal",
              "kosher"
            ],
            "default": "omnivore"
          },
          "restrictions": {
            "type": "array",
            "description": "May be empty for a member with no restrictions — but the member must still be listed, so a missing member is distinguishable from an unrestricted one.",
            "items": {
              "type": "object",
              "required": [
                "ingredient",
                "tier",
                "kind"
              ],
              "additionalProperties": false,
              "properties": {
                "ingredient": {
                  "type": "string",
                  "minLength": 2,
                  "description": "Canonical name of the thing to avoid."
                },
                "aliases": {
                  "type": "array",
                  "items": {
                    "type": "string",
                    "minLength": 3
                  },
                  "description": "REQUIRED IN PRACTICE for allergies. Retailer product titles say 'almond meal', never 'tree nuts'. Matching on the canonical name alone misses the actual product on the shelf. List every derivative and trade name you can think of."
                },
                "tier": {
                  "type": "string",
                  "enum": [
                    "life_threatening",
                    "medical_avoid",
                    "ethical_religious",
                    "dislike"
                  ],
                  "description": "Drives which code path handles it — these must not be collapsed. life_threatening: anaphylaxis risk; drop the recipe entirely, block the product, NO substitutions, abort the run if profile data is missing or stale. medical_avoid: intolerance or medical diet (coeliac, low-FODMAP); same fail-closed posture, substitution only under human review. ethical_religious: hard filter on planning and ordering, but missing data warns rather than aborts. dislike: scoring penalty only; never blocks a purchase."
                },
                "kind": {
                  "type": "string",
                  "enum": [
                    "allergy",
                    "intolerance",
                    "medical",
                    "religious",
                    "ethical",
                    "preference"
                  ]
                },
                "cross_contamination_risk": {
                  "type": "boolean",
                  "default": false,
                  "description": "When true, 'may contain traces' labelling is disqualifying, not advisory."
                },
                "notes": {
                  "type": [
                    "string",
                    "null"
                  ]
                },
                "confirmed_by": {
                  "type": [
                    "string",
                    "null"
                  ],
                  "description": "Who last confirmed this restriction. An allergy record with no attribution is a rumour."
                },
                "confirmed_on": {
                  "type": [
                    "string",
                    "null"
                  ],
                  "format": "date"
                }
              }
            }
          },
          "cultural_patterns": {
            "type": "array",
            "description": "Day-scoped or recurring meal rules that are not ingredient restrictions.",
            "items": {
              "type": "object",
              "required": [
                "rule",
                "tier"
              ],
              "additionalProperties": false,
              "properties": {
                "rule": {
                  "type": "string",
                  "description": "e.g. 'fish on Fridays'"
                },
                "byday": {
                  "type": "array",
                  "items": {
                    "type": "string",
                    "enum": [
                      "MO",
                      "TU",
                      "WE",
                      "TH",
                      "FR",
                      "SA",
                      "SU"
                    ]
                  }
                },
                "tier": {
                  "type": "string",
                  "enum": [
                    "ethical_religious",
                    "dislike"
                  ]
                }
              }
            }
          }
        }
      }
    },
    "household_id": {
      "type": "string",
      "description": "Legacy field from older local profiles. Not used to select or identify the authorised MCP household."
    }
  }
}
