{ "schema_version": 1, "household_id": "fixture-household", "updated_at": "REPLACED_AT_RUNTIME", "source": "manual",
  "members": [ { "member_id": "m1", "display_name": "Sam", "dietary_pattern": "omnivore",
    "restrictions": [ { "ingredient": "mushrooms", "aliases": ["mushroom","button mushroom"],
      "tier": "dislike", "kind": "preference", "cross_contamination_risk": false } ] } ] }
